,estilo,artist_url,song_url,lyrics
523,rom,https://acordes.lacuerda.net/tormenta/,https://acordes.lacuerda.net/tormenta/desde_el_abismo,"Quiero contarte este amargo dolor<br>(como decirte que extraño tu voz<br>como explicar que es dificil vivir<br>verte jugar, verte reir<br>Gota tras gota de mi me olvide,<br>siempre tus ojos preguntan porque<br>desde el abismo es todo tan gris<br>es mi manera de sobrevivir<br>quiero olvidar, quiero volver a empezar<br>hay si yo fuera capaz de luchar<br>y cuando de niño me hicieron llorar<br>de tantas cosas, podria escapar<br>si me enseñaras tu forma de amar.<br>repite()<br>Quiero olvidar quiero volver a empezar"
524,rom,https://acordes.lacuerda.net/tormenta/,https://acordes.lacuerda.net/tormenta/esta_noche_sere_tuya,"Esta noche sere tuya,solamente tuya<br>en tus brazos lentamente, yo voy a caer<br>esta noche y para siempre, dormirás conmigo<br>y jamás vas a querer otra mujer<br>esta noche sere tuya, solamente tuya<br>esta noche, te lo juro que me entregaré<br>y te ofrecere mi cuerpo, y también la luna<br>para que tu boca juege con mi piel<br>te quiero, te quiero, que dulce es amarte<br>toda esta ternura esa quiero guardarme<br>te quiero, te quiero, mi amor es tan grande<br>el tiempo ha pasado y no pude olvidarte<br>por amor, estoy aqui, solo tu, me haces felíz<br>(para ti, corazón valiente)<br>esta noche sere tuya, tu serás tan mío<br>porque ya lo he decidido, y miedo no tendré<br>me desvestiras despacio, en la noche oscura<br>esta noche sere tuya, vas a ver<br>te quiero, te quiero, que dulce es amarte<br>toda esta ternura no quiero guardarme<br>te quiero, te quiero, mi amor es tan grande<br>el tiempo ha pasado y no pude olvidarte<br>por amor, estoy aquí, solo tu, me haces felíz<br>esta noche sere tuya, solamente tuya<br>en tus brazos lentamente, yo voy a caer<br>esta noche y para siempre, dormirás conmigo<br>y jamás vas a querer otra mujer.<br>Final Acordes C G C G C<br>Espero que les guste y agradezco comentarios, es mi primera colaboración."
525,rom,https://acordes.lacuerda.net/tormenta/,https://acordes.lacuerda.net/tormenta/hay_un_sentimiento,"Es un dulce sentimiento,<br>el que yo siento por tí,<br>aunque pase mucho tiempo,<br>él me ayudará a vivir.<br>Es un dulce sentimiento,<br>el que llevo bajo mi piel,<br>alegrías y tristezas,<br>nacen hoy soló por él.<br>Por que yo, quisiera,<br>descansae entre tus brazos,<br>hoy, sin pena, sin penas.<br>Por que yo, yo, yo, te quiero,<br>y en mis sueños y en todos mis días,<br>te pienso, te pienso.<br>Se repiten Estrofas<br>1-3 (una vez) 4 (tre veces.<br>Esta canción esta al tono del disco"
526,rom,https://acordes.lacuerda.net/tormenta/,https://acordes.lacuerda.net/tormenta/media_noche_contigo,"Quédate, o mi amor..<br>respiremos el aire puro.<br>Quédate, quiero hoy<br>abrazarte lejos del mundo<br>y serás, mi razón,<br>mi camino, mi rebelión.<br>Quedare que esta noche por ti, yo renazco mi vida,<br>te está llamando..<br>Medianoche,<br>me acaricias, me recorres.<br>Medianoche.<br>Hasta el alba.<br>Siento nacer la alegría de ser amada.<br>Medianoche,<br>no hay preguntas, no hay palabras.<br>Solamente, tuya, tuya<br>Solamente las estrellas de cielo alumbran.<br>Quédate, o mi amor,<br>una historia te contaré,<br>te daré cariño, si te vuelves un poco niño.<br>Te daré lo que soy, mis recuerdos y mi dolor.<br>Medianoche ya es, con tu risa y tu piel,<br>con un dulce sabor a miel.<br>REPITE LOS MISMOS ACORDES<br>Medianoche,<br>me acaricias, me recorres.<br>Medianoche,<br>hasta el alba.<br>Siento nacer la alegría, de ser amada.<br>Medianoche,<br>no hay preguntas, no hay palabras,<br>solamente tuya, tuya.<br>Solamente las estrellas del cielo alumbran.<br>Medianoche.."
527,rom,https://acordes.lacuerda.net/tormenta/,https://acordes.lacuerda.net/tormenta/muchacho_de_blue_jeans,"Vi tu perfil...llegando en la tarde hasta mi<br>cruza las calles corriendo y volviendo a sonreir,<br>y vas saltando los charcos que la lluvia se olvido<br>tu rostro al viento silbando despacito una canción...<br>vas con las zapatillas viejas<br>los blue jeans bajo el sol<br>te abraza el viento entre las copas<br>de los árboles en flor<br>pero muchacho de blue jeans acercate más hacia mi...<br>Ay! mi muchacho de blue jeans ya nunca dejes de cantar<br>deja tu pelo alborotado a los vientos que más dá...<br>Ay! mi muchacho de blue jeans ya nunca dejes de cantar<br>deja tu pelo alborotado a los vientos que más dá...<br>Corre ligero y acuéstate en la hierba sin pensar<br>ya son las nueve en el reloj<br>habrá que irse hacia el hogar,<br>y doblaremos la esquina triste<br>brillaran las luces más<br>la luna me estará esperando sobre el patio del zagüan....<br>pero muchacho de blue jeans acercate más hacia mi...<br>Ay! mi muchacho de blue jeans ya nunca dejes de cantar<br>deja tu pelo alborotado a los vientos que mas da...<br>Ay! mi muchacho de blue jeans ya nunca dejes de cantar<br>deja tu pelo alborotado a los vientos que más dá...<br>Ay! mi muchacho de blue jeans ya nunca dejes de cantar<br>deja tu pelo alborotado a los vientos que mas da...etc"
528,rom,https://acordes.lacuerda.net/tormenta/,https://acordes.lacuerda.net/tormenta/no_llores_vida_no_llores_mas,"No llores vida, no llores más,<br>no tengas miedo, miedo de mar,<br>no ves que yo estoy sintiendo,<br>tanta nostalgia día tras día.<br>No llores vida, si yo también,<br>cien alegrías por tí lloré,<br>no ves que siempre recuerdo,<br>cosas pequeñas que siempre vivimos.<br>Yo quiero volver a amarte hoy,<br>hoy yo nada tengo y nada soy,<br>quiero tus caricias otra vez,<br>quiero volver amar.<br>Buscaré una mañana para mí,<br>quiero cada día más de tí,<br>y junto a tu cuerpo anochecer,<br>quiero volver amar.<br>No llores vida , no llores más,<br>tanta tristeza, te ha de hacer mal,<br>mira que siempre recuerdo,<br>cosas pequeñas, que ayer vivimos.<br>Se repiten 2 veces las estrofas 1 y 2"
529,rom,https://acordes.lacuerda.net/tormenta/,https://acordes.lacuerda.net/tormenta/pequenio_amor_te_llevo_siempre_en_mi,"Pequeño amor te llevo siempre en mi.<br>me he vuelto flor para sembrarme en ti<br>eres la sed que nunca calmare,<br>profundo sol donde abrigar mi soledad<br>eres pequeño y grande,<br>inmenso en mi canción<br>Yo quiero ser un poco tierra y ver<br>como crecer debajo de tu piel<br>pequeños cielos con tu voz andar<br>luego volar junto a los pájaros<br>del mar<br>y dar mi luz, mi oscuridad<br>y amarte compañero<br>Déjame ser paloma por ultima vez, después<br>morir volando así dentro de ti,<br>se fue el dolor, hay en tu corazón un sol,<br>pequeño sol que lentamente me quemó<br>Pequeño amor en tu camino voy y<br>tu dolor se vuelve mi dolor"
530,rom,https://acordes.lacuerda.net/tormenta/,https://acordes.lacuerda.net/tormenta/perdoname_he_sido_una_tonta,"Perdóname, perdóname amor, soy una tonta,<br>perdóname, ya ves que tiemblo amor, estoy llorando,<br>me fuí con él, porqué pensé que tú, ya no me amabas,<br>más debes de saber, que aún estando con él,<br>yo te pensaba.<br>Perdóname, me duelen en la piel, cada caricia,<br>perdóname, me sentiré morir, si no sonríes,<br>abrázame, porque al final ya ves, he comprendido,<br>no me comportaré, como una chiquitina,<br>sin un motivo.<br>Perdóname, busqué su amor quizás, por olvidarte,<br>para calmar, esta gris soledad, entre tus brazos,<br>tú sabes bién, que siempre respiré, con tu recuerdo,<br>con todo lo que tú me has dado sin pedirme,<br>nada a cambio.<br>Perdóna, perdóna, perdóna yo soy sincera,<br>pués eso no quiere decir, de que yo le quiera,<br>pues verás como tu dolor lo borrará el tiempo,<br>anda comprende que cuenta, sólo un momento hay.<br>Se repite la 1,2y 3 estrofa.<br>Esta canción está al mismo tono<br>que en el disco."
531,rom,https://acordes.lacuerda.net/tormenta/,https://acordes.lacuerda.net/tormenta/por_aquellos_dias_de_nuestro_ayer,"Amor ,me quedo llorando..porque yo te quise tanto<br>querido amor..un poco riendo..un poco llorando<br>yo recuerdo los días de ayer...<br>Amor ,es dulce el olvido..despúes de amar como niños<br>querido amor ,tú sabes le tengo yo miedo al silencio<br>recordando los días de ayer...<br>Tengo un motivo para llorar pués se<br>agranda en mi pecho la soledad<br>yo te quiero,te quiero y nada es igual,a los días de nuestro ayer...<br>Y si quisieras volver atrás yo tendría tanto amor para comenzar<br>y robarle a la vida un sueño más por los días de nuestro ayer.<br>Amor ,me quedo llorando..porque yo te quise tanto<br>querido amor..un poco riendo..un poco llorando<br>yo recuerdo los días de ayer...<br>y...na,na,na,na,na,na,na,na...<br>recordando los días de ayer...<br>y...na,na,na,na,na,na,na,na...<br>querido amor,tú sabes le tengo yo miedo al silencio<br>recordando los días de ayer...<br>Amor ,me quedo llorando..porque yo te quise tanto<br>querido amor..un poco riendo..un poco llorando<br>yo recuerdo los días de ayer...<br>Amor ,es dulce el olvido..etc.<br>na,na,na,na,na,..etc."
532,rom,https://acordes.lacuerda.net/tormenta/,https://acordes.lacuerda.net/tormenta/por_favor_me_siento_sola,"Por qué no vivo sin tu amor<br>Sin tus caricias, sin tu voz<br>Por qué que me duele despertar<br>Sola en la casa si no estás.<br>Siempre esperando si vendrás<br>Imaginando dónde estás<br>Quién en tus brazos mimarás<br>Quién a tu lado dormirá.<br>Por qué no vivo sin tu amor<br>Tantos recuerdos tengo hoy<br>En este cuarto donde ayer<br>Nos confundimos piel a piel.<br>Yo que no vivo sin tu amor<br>Quiero tu cuerpo acariciar<br>Quiero que vuelvas como ayer<br>Estoy cansada de llorar.<br>ESTRIBILLO<br>Por favor, me siento sola<br>Sólo quisiera yo saber si aún me añoras<br>Pues solamente quiero un poco de felicidad<br>Yo no te puedo, no te puedo olvidar.<br>Por qué no vivo sin tu amor...<br>Siempre esperando si vendrás...<br>Por favor me siento sola...<br>Nananananananana, nananananananana, nananananananana, nananananananana<br>Yo que no vivo<br>sin tu amor...<br>Por favor me siento sola...<br>Nananananananana...<br>Yo solamente quiero un poco de felicidad<br>Yo no te puedo, no te puedo olvidar<br>Nananananananana..."
533,rom,https://acordes.lacuerda.net/tormenta/,https://acordes.lacuerda.net/tormenta/por_que_te_quiero_igual,"Porque te quiero igual, no gastará mi amor<br>el tiempo<br>Porque yo se esperar te llevaré en mi piel<br>en cada amanecer<br>Dices adiós estas pensando en mi,<br>dices adiós y el día esta mas gris<br>Porque te quiero igual es que me acostumbre     F#m<br>al silencio<br>y nuestra calle esta llena de soledad,<br>si tu no estas amor<br>Dices adiós, porque te cuesta amar,<br>dices que estás buscando tu verdad,<br>que quieres libertad..<br>Cuando pase el tiempo, se que lloraras también<br>no tendré tus ojos, no tendrás mi piel<br>y sin darte cuenta se que pronto tu serás<br>IGUAL QUE LA ANTERIOR<br>Porque te quiero igual, no gastará mi amor<br>el tiempo,<br>porque yo se esperar, te llevaré en mi piel<br>en cada amanecer..<br>Dices adiós estas pensando en mi,<br>dices adiós y el día esta mas gris<br>Cuando pase el tiempo, se que lloraras también<br>no tendré tus ojos, no tendrás mi piel<br>y sin darte cuenta se que pronto tu serás<br>Porque te quiero igual<br>(te quiero igual)  [CORO]<br>te quiero igual,<br>Porque yo se esperar<br>( yo se esperar)<br>Yo se esperar.<br>Porque te quiero igual,<br>( te quiero igual)<br>Porque te quiero igual<br>te quiero igual."
534,rom,https://acordes.lacuerda.net/tormenta/,https://acordes.lacuerda.net/tormenta/porque_se_parece_a_mi,"PORQUE SE PARECE A MI, Y TIENE MIS MISMOS AÑOS<br>ME QUIERES OLVIDAR,EN SU CUERPO Y EN SUS LABIOS<br>RITMICO<br>ELLA SE PARECE A MI,ES TU AMOR TU COMPAÑERA<br>ROSTRO LEJANO AMOR,SE PARECE A LAS ESTRELLAS<br>NO ME QUIERAS OLVIDAR,NO TRATES DE BORRAR,<br>TANTOS RECUERDOS.<br>MI VERDADERO AMOR, NO VUSQUES OTRA EN MI LUGAR,<br>YO YA NO SOY FELIZ, YO YA NO VIVO ASÍ,<br>QUIERO TENERTE PARA MI<br>QUIERO ABRIGARTE DE SOL, Y DARTE MI CALOR,<br>QUIERO SENTIRME AMADA<br>AY MI VERDADERO AMOR DIME PORQUE DIJISTE ADIOS<br>YO YA NO PUEDO AMAR,YA NO VIVO MAS,<br>QUIERO TENERTE PARA MI, QUIERO TENERTE PARA MI.<br>POQUE SE PARECE A MI, Y TIENE MIS MISMOS AÑOS,<br>ME QUIERES OLVIDAR, EN SU CUERPO Y EN SUS LABIOS<br>PERO TE AGRADEZCO IGUAL,LOS MOMENTOS DE TERNURA,<br>SI JUGABAMOS A AMAR, COMO EL VIENTO CON LA ESPUMA<br>NO ME QUIERAS OLVIDAR,NO TRATES DE BORRAR<br>TANTOS RECUERDOS.<br>MI VERDADERO AMOR......BIS CORO 1 Y 2<br>SI NECESITAS MAS ACORDES DE BALADAS DEL AYER ESCRIBEME."
535,rom,https://acordes.lacuerda.net/tormenta/,https://acordes.lacuerda.net/tormenta/porque_te_quiero_igual,"Porque te quiero igual, no gastará mi amor<br>el tiempo<br>Porque yo se esperar te llevaré en mi piel<br>en cada amanecer<br>Dices adiós estas pensando en mi,<br>dices adiós y el día esta mas gris<br>Porque te quiero igual es que me acostumbre<br>al silencio<br>y nuestra calle esta llena de soledad,<br>si tu no estas amor<br>Dices adiós, porque te cuesta amar,<br>dices que estás buscando tu verdad,<br>que quieres libertad..<br>Cuando pase el tiempo, se que lloraras también<br>no tendré tus ojos, no tendrás mi piel<br>y sin darte cuenta se que pronto tu serás<br>IGUAL QUE LA ANTERIOR<br>Porque te quiero igual, no gastará mi amor<br>el tiempo,<br>porque yo se esperar, te llevaré en mi piel<br>en cada amanecer..<br>Dices adiós estas pensando en mi,<br>dices adiós y el día esta mas gris<br>Cuando pase el tiempo, se que lloraras también<br>no tendré tus ojos, no tendrás mi piel<br>y sin darte cuenta se que pronto tu serás<br>Porque te quiero igual<br>(te quiero igual)  [CORO]<br>te quiero igual,<br>Porque yo se esperar<br>( yo se esperar)<br>Yo se esperar.<br>Porque te quiero igual,<br>( te quiero igual)<br>Porque te quiero igual<br>te quiero igual.<br>Pero la verdad es que usan La7# y La7 en vez de Fa y Mi.<br>Yo no sé porque, será para que parezca que es más complicada de lo que es.<br>No estoy de acuerdo. La canción es así."
536,rom,https://acordes.lacuerda.net/tormenta/,https://acordes.lacuerda.net/tormenta/portenio_triste,"Dame tu mano Porteño caminemos y miremos tu ciudad<br>ha..ha..ha...ha..<br>háblame de vos, porteño..de los sueños,<br>de tu infancia y algo mas.. ha..ha..ha..<br>Porteño triste, adónde vas?, Porteño triste, sinceridad<br>Porteño triste que puedo hacer si no quieres responder.. BIS<br>Cuéntame todas tus cosas, tu alegría, tu vacio y tu dolor<br>Yo se que sufres Porteño..que no encuentras el camino<br>que te lleve hacia tu amor si..si..hacia su amor.<br>REPITE LOS MISMOS ACORDES<br>Porteño triste, adónde vas?, Porteño triste, sinceridad<br>Porteño triste que puedo hacer si no quieres responder..<br>Porteño triste, adónde vas?, Porteño triste, sinceridad<br>Porteño triste que puedo hacer si no quieres responder.."
537,rom,https://acordes.lacuerda.net/tormenta/,https://acordes.lacuerda.net/tormenta/promesas_son_promesas,"Promesas son promesas,<br>no quieras olvidarlo,<br>promesas que aquel día,<br>me dijiste llorando.<br>Promesas son promesas,<br>se borran con los años,<br>como a todas las cosas,<br>que ayer hemos amado.<br>Prometiste darme amor,<br>y ser el fuego de mi hogar,<br>ser esa barca que hacia el mar me llevaría.<br>Golondrina mansa que,<br>siempre que a mi nido volverá,<br>cuántos poemas, cuánto amor,<br>amanecían con el sol,<br>me prometiste amor, lo prometíste.<br>Se repiten las estrofas 1 y 2.<br>Prometiste darme paz,<br>y ser mi luna y mi candíl,<br>cuantas carícias así, me prometiste.<br>Yo seré el camino igual,<br>ya no tendré miedo de andar,<br>buscando amor en otra piel,<br>y sin promesas, le amaré,<br>me prometiste amor, lo prometiste.<br>Se repiten las estrofas 1 y 2 (2 veces)<br>Esta canción esta al mismo tono que en el disco."
538,rom,https://acordes.lacuerda.net/tormenta/,https://acordes.lacuerda.net/tormenta/si_fuera_como_ayer,LLORA LLORA CORAZON<br>QUE YA TODO ME DA IGUAL<br>AMOR......CON QUIEN ESTAS<br>QUIEN TE DA CARIÑO<br>QUIEN TE DA CALOR<br>QUIEN TE DA SU VIDA COMO YO<br>LLORA LLORA CORAZON<br>QUE SILENCIO QUE DOLOR<br>AMOR......QUE SOLEDAD<br>HOY TU CUERPO TIEMBLA<br>CADA AMANECER<br>OTROS OJOS MIRAS AL QUERER<br>SI FUERA COMO AYER CUANDO EL AMOR NACIO<br>BESANDONOS LA LLUVIA<br>NOS MOJO<br>SOÑAR YA NUNCA MAS<br>CON FLORES NI CHAMPAGNE<br>Y EL FUEGO CALENTANDO EN EL HOGAR<br>LLORA LLORA CORAZON<br>AMOR......RESPONDEME<br>QUIEN TE DA CARIÑO<br>QUIEN TE DA CALOR<br>QUIEN TE DA SU VIDA COMO YO<br>y vuel ve a repetir el estribillo<br>SI FUERA COMO AYER<br>CUANDO EL AMOR NACIO<br>BESANDONOS LA LLUVIA<br>NOS MOJO<br>sOÑAR YA NUNCA MAS<br>CON FLORES NI CHAMPAGNE<br>NI EL FUEGO CALENTANDO EN EL HOGAR<br>POR ESO<br>LLORA LLORA CORAZON<br>AMOR......CON QUIEN ESTAS<br>LLORA LLORA CORAZON<br>aMOR ......RESPONDEME<br>LLORA LLORA CORAZON .
539,rom,https://acordes.lacuerda.net/tormenta/,https://acordes.lacuerda.net/tormenta/son_lagrimas_por_tu_recuerdo,"Porque yo aún te sigo amando,<br>y mi guitarra está llorando,<br>te llegará, esta canción,<br>así sabras ,igual que yo,<br>y hoy solo soy, lágrimas por tu recuerdo.<br>Quisiera amor que tu sonrias,<br>y poder ser yo tu alegría,<br>quisiera ser, como un gorrión,<br>y andar tu piel, buscando amor,<br>pues solo soy, lágrimas por tu recuerdo.<br>Pero mañana, yo volveré,<br>cuendo se esconda el día,<br>y te diré lo triste que estoy,<br>son días de melancolía.<br>Para secar las lágrimas que derramé en silencio,<br>si mi guitarra supo llorar,<br>junto a mis fogosos sueños.<br>Se repiten las estrofas 1 y 2(dos veces)<br>Esta canción esta al mismo tono<br>que en el disco."
540,rom,https://acordes.lacuerda.net/tormenta/,https://acordes.lacuerda.net/tormenta/una_carta_en_la_distancia,"Sabes, mi amor, qué extraña desolación<br>Llueve en mi alma y aquí sola estoy<br>mientras te escribo esta carta hoy<br>Sabes, mi amor, no hay nadie en mi habitación,<br>sólo en la radio suena una canción<br>y en mi interior yo busco la verdad<br>mi luz, mi libertad<br>Será, será el amanecer<br>Será, tal vez, el rumor de un tren<br>Será, será porque sin querer<br>escucho tu risa, siento tus pasos<br>Viejos papeles donde te contaré<br>que a la tristeza yo me acostumbré<br>porque es mi carta una pequeña flor<br>dentro de un buzón<br>Será, será tanta soledad<br>Será, tal vez, esta sed de amar<br>Será, será que no sé olvidar<br>Te escribo una carta en la distancia<br>Será, será el amanecer<br>Será, tal vez, porque yo te amé<br>Será, será porque sin querer<br>escucho tu risa, siento tus pasos<br>Será, será, será tanta soledad<br>Será, tal vez, esta sed de amar<br>Será, será que no sé olvidar<br>Te escribo una carta en la distancia<br>@rafael.dickens"
541,rom,https://acordes.lacuerda.net/tormenta/,https://acordes.lacuerda.net/tormenta/vagabundo_vuelve,"Estoy mirando por esa ventana como el sol se va<br>Atardecer de otoño en  mi jardín con hojas secas<br>Y junto al fuego toca la guitarra y te siento cerca<br>Siempre llegando con una sonrisa<br>Una caricia la corbata suelta<br>Tejiendo locos sueños al andar<br>Estoy mirando si en el horizonte te puedo encontrar<br>Y dejaré la puerta siempre abierta si es que vas a entrar<br>Yo sé que estás vagando por andenes juntando flores<br>Y repartiendo pedazos de pan<br>A las palomas que a la plaza van<br>Tejiendo locos sueños al andar<br>Vagabundo vuelve de nuevo a mi patio te abriré la puerta<br>Vagabundo sabes que junto a esta reja te siento más cerca<br>Vagabundo piensa, te estuve esperando junto a esta ventana<br>Pero ahora solo cantaré, reiré y no lloraré<br>Sabes vagabundo un poema te guardaré<br>Estoy mirando por esa ventana como el sol se va<br>Atardecer de otoño en  mi jardín con hojas secas<br>Y junto al fuego toca la guitarra y te siento cerca<br>Siempre llegando con una sonrisa<br>Una caricia la corbata suelta<br>Tejiendo locos sueños al andar<br>Vagabundo vuelve de nuevo a mi patio te abriré la puerta<br>Vagabundo sabes que junto a esta reja te siento más cerca<br>Vagabundo piensa, te estuve esperando junto a esta ventana<br>Pero ahora solo cantaré, reiré y no lloraré<br>Sabes vagabundo un poeta te guardaré<br>Vagabundo vuelve de nuevo a mi patio te abriré la puerta<br>Vagabundo sabes que junto a esta reja te siento más cerca<br>Vagabundo vuelve de nuevo a mi patio te abriré la puerta<br>Vagabundo sabes que junto a esta reja te siento más cerca..."
542,rom,https://acordes.lacuerda.net/tormenta/,https://acordes.lacuerda.net/tormenta/volvere_a_ba_as_en_la_primavera,"Solamente adiós, ya se hace tarde debo irme<br>partirá mi avión. Solamente adiós,<br>quedo vacío el aeropuerto mientras tu y yo<br>como dos niños repetimos<br>una palabra nada mas, recuérdame<br>recuérdame<br>Recuérdame yo volveré a Buenos Aires en la primavera,<br>recuérdame en Bs. As cuando en invierno llueva<br>recuérdame en cada piel, en cada flor, en cada canción<br>pues yo estaré en cualquier lugar nombrándote.        2(BIS)<br>Yo regresaré a nuestra calle a nuestra plaza<br>nuestro amanecer. Ver florecer Bs. As. con el sol<br>de primavera que la da la luz a mis palabras<br>son dos palabras que diré te recordé, te recordé<br>REPITE EL ESTRIBILLO"
543,rom,https://acordes.lacuerda.net/tormenta/,https://acordes.lacuerda.net/tormenta/vuelve_padre_sol,Quédate buscando<br>La espiga que arrastró el viento<br>Vistiendo mi piel con espuma<br>De nuestro padre<br>Quédate en mi cuerpo<br>Con el idioma del silencio<br>Mi piel te seguirá en tu huella<br>La de mi padre<br>Deja que entre el sol otra vez<br>Y después nos iremos corriendo tras el<br>Padre sol<br>Dormida en la arena<br>Caminaré sobre las aguas<br>Tu mano seguirá en mi mano<br>Y en nuestro padre<br>Donde vive el viento<br>Y donde el sol forma la luz<br>Donde tus ojos miran fijos<br>Con nuestro padre<br>Deja que entre el sol otra vez<br>Y después nos iremos corriendo tras el<br>Padre sol<br>Deja que pinte la tierra de luz<br>Y que abrace mis ojos sin dejarle ir<br>Padre sol.
544,rom,https://acordes.lacuerda.net/tormenta/,https://acordes.lacuerda.net/tormenta/yo_quiero_compartir_todo_lo_tuyo,"Quiero vivír a tu lado, lo prometí,<br>y despertar de alegría solo por tí,<br>quiero vivír a tu lado siempre mi amor,<br>quiero buscar un camino solo para los dos.<br>Dame calor, quiero vivír a tu lado mi amor,<br>y compartir, juntos la misma casa,<br>y donde estes siempre a tu lado,<br>sentirme mujer, ven dame calor,<br>eres lo que más quiero.<br>Por eso quiero vivír a tu lado, lo prometí,<br>y despertar de alegría solo por tí,la ray, lay la.<br>Quiero vivír a tu lado siempre mi amor,<br>quiero buscar un camino solo para los dos,<br>dame calor, no quiero más dormir sola mi amor,<br>dulce será, amanecer contigo.<br>Y quiero amar, junto a tu cuerpo poder descansar,<br>ven dame calor, quiero vivír contigo.<br>Por eso quiero vivír a tu lado, lo prometí,<br>y despertar de alegría solo por tí,la ray, lay la.<br>Quiero vivír a tu lado siempre mi amor,<br>quiero buscar un camino solo para los dos,<br>Por eso quiero vivír a tu lado, lo prometí,<br>y despertar de alegría solo por tí,la ray, lay la.<br>Quiero vivír a tu lado siempre mi amor,<br>quiero buscar un camino solo para los dos,<br>Esta canción esta al mismo tono<br>que en el disco."
545,rom,https://acordes.lacuerda.net/verano_98/,https://acordes.lacuerda.net/verano_98/bellisima,"VERSO<br>Suave, suavisimo y despacio<br>que casi no lo siento,<br>puedo decirtelo.<br>Quiero que sepas que te amo<br>pero que es imposible,<br>por eso amor me voy.<br>Suave, suavisimo y despacio<br>para que no se entere<br>mi pobre corazon,<br>esto es una despedida<br>no llores mas querida,<br>me duele tu dolor.<br>PRECORO<br>Te ves bellisima   cuando lloras,<br>te ves bellisima   cuando ries,<br>cuando escuchas este pequeño chau,<br>chau bellisima, chau,<br>quisiera ser tu amor   pero no pudo ser,<br>chau bellisima, chau,<br>yo se que alguna vez   me vas a comprender.<br>Chau, bellisima, chau.<br>VERSO2<br>Suave, suavisimo y despacio<br>me alejo de tu lado<br>y te veo partir,<br>lloras y se me va la vida,<br>bellisima querida<br>hoy me siento morir.<br>PRECORO<br>Te ves bellisima   cuando lloras,<br>te ves bellisima   cuando ries,<br>cuando escuchas este pequeño chau,<br>chau bellisima, chau,<br>quisiera ser tu amor   pero no pudo ser,<br>chau bellisima, chau,<br>yo se que alguna vez   me vas a comprender.<br>Chau, bellisima,    chaaaaaaaauuu.<br>Descarguen el mp3 aca<br>http://www.4shared.com/file/131521181/c7cbcd1b/V98-bellsima.html"
546,rom,https://acordes.lacuerda.net/verano_98/,https://acordes.lacuerda.net/verano_98/cuando_el_corazon_me_mate,"Como una hamaca vacía<br>Las penas y alegrías,<br>Van y vienen<br>Y de pronto se detienen<br>Cuando tú, pájaro duende,<br>Apareces.<br>Como un jardín tan desierto<br>Me lleno hoy de jazmines<br>Y te espero,<br>Sin preguntas para hacerte<br>Tú y yo<br>Pájaro duende.<br>Cuando el corazón me mate<br>De tanto amarte<br>Sepultaré este hombre<br>Y saldré a buscarte.<br>Cuando el corazón<br>Me mate de tanto amarte<br>Me olvidaré de todo<br>Pájaro duende<br>Y te amaré,<br>Y volaré<br>Hasta alcanzarte.<br>Como un hambriento sin hambre<br>Clausuré mis ganas<br>De repente<br>Inventé el modo de irme<br>Porque tú, jamás vendrás<br>Pájaro duende.<br>Cuando el corazón me mate<br>De tanto amarte<br>Sepultaré este hombre<br>Y saldré a buscarte.<br>Cuando el corazón<br>Me mate de tanto amarte<br>Me olvidaré de todo<br>Pájaro duende<br>Y te amaré,Y volaré<br>Hasta alcanzarte.<br>Cuando el corazón me mate<br>De tanto amarte<br>Sepultaré este hombre<br>Y saldré a buscarte.<br>Cuando el corazón<br>Me mate de tanto amarte<br>Me olvidaré de todo<br>Pájaro duende<br>Y te amaré,<br>Y volaré, volaré<br>Hasta alcanzarte."
